{
  "$schema": "https://json-schema.org/draft/2020-12/schema",
  "title": "Draftory source manifest v0.1.0",
  "description": "Acquisition provenance only; not a player or simulation contract.",
  "type": "object",
  "additionalProperties": false,
  "required": [
    "schemaVersion",
    "source",
    "release",
    "url",
    "retrievedAt",
    "sha256",
    "files"
  ],
  "properties": {
    "schemaVersion": { "const": "0.1.0" },
    "source": { "type": "string", "minLength": 1 },
    "release": { "type": "string", "minLength": 1 },
    "url": { "type": "string", "format": "uri", "pattern": "^https://" },
    "retrievedAt": { "type": "string", "format": "date-time" },
    "sha256": { "type": "string", "pattern": "^[a-f0-9]{64}$" },
    "files": {
      "type": "array",
      "minItems": 1,
      "items": {
        "type": "object",
        "additionalProperties": false,
        "required": ["path", "sha256"],
        "properties": {
          "path": { "type": "string", "minLength": 1 },
          "sha256": { "type": "string", "pattern": "^[a-f0-9]{64}$" }
        }
      }
    }
  }
}
